[
  {
    "id": "ASS-001",
    "category": "pricing",
    "statement": "Prezzo di listino ipotizzato per punto vendita al mese",
    "value": 65,
    "unit": "EUR/PV/mese",
    "base_case": 65,
    "downside_case": 50,
    "upside_case": 80,
    "source": "Intervista con 1 titolare di catena su 4 (EVD-002)",
    "owner": "founder",
    "confidence": "low",
    "validation_status": "unvalidated",
    "affected_sections": [
      "00_idea-discovery",
      "05_business-model",
      "10_financial-plan"
    ],
    "last_updated": "2026-07-10"
  },
  {
    "id": "ASS-002",
    "category": "value-metric",
    "statement": "Tempo settimanale risparmiato dal manager grazie a TurniDemo",
    "value": 3.5,
    "unit": "ore/settimana",
    "base_case": 3.5,
    "downside_case": 2,
    "upside_case": 5,
    "source": "Media dichiarata dalle 4 interviste qualitative (EVD-001..EVD-003)",
    "owner": "founder",
    "confidence": "medium",
    "validation_status": "unvalidated",
    "affected_sections": [
      "00_idea-discovery",
      "03_value-proposition"
    ],
    "last_updated": "2026-07-10"
  },
  {
    "id": "ASS-003",
    "category": "conversion",
    "statement": "Tasso di conversione da demo a cliente pagante",
    "value": null,
    "unit": "%",
    "base_case": null,
    "downside_case": null,
    "upside_case": null,
    "source": "Nessun dato disponibile: nessuna demo ancora eseguita",
    "owner": "founder",
    "confidence": "low",
    "validation_status": "needs_info",
    "affected_sections": [
      "06_go-to-market",
      "10_financial-plan"
    ],
    "last_updated": "2026-07-10"
  },
  {
    "id": "ASS-004",
    "category": "market",
    "variable": "eligible_pv",
    "statement": "Punti vendita eleggibili in Italia (catene 3-20 PV, retail e ristorazione)",
    "value": 60000,
    "display_value": "60000 count",
    "unit": "count",
    "source": "Stima fittizia su dati camerali ipotetici (da validare, downside)",
    "owner": "founder",
    "confidence": "low",
    "validation_status": "unvalidated",
    "evidence_classification": "model_estimate",
    "affected_sections": [
      "04_market-and-competition"
    ],
    "last_updated": "2026-07-16",
    "previous_values": []
  },
  {
    "id": "ASS-005",
    "category": "market",
    "variable": "arpa_pv_year",
    "statement": "Valore annuo per punto vendita: listino ASS-001 (65 EUR/PV/mese) x 12, nessuno sconto in Y1",
    "value": 780,
    "display_value": "780 EUR/count",
    "unit": "EUR/count",
    "source": "Founder + concept Sezione 0",
    "owner": "founder",
    "confidence": "low",
    "validation_status": "unvalidated",
    "evidence_classification": "founder_assumption",
    "affected_sections": [
      "04_market-and-competition",
      "05_business-model"
    ],
    "last_updated": "2026-07-16",
    "previous_values": []
  },
  {
    "id": "ASS-006",
    "category": "market",
    "variable": "tam_topdown",
    "statement": "TAM top-down: spesa software workforce management PMI Italia (report di settore, da validare)",
    "value": 50000000,
    "display_value": "50000000 EUR",
    "unit": "EUR",
    "source": "Report di settore citato in Sezione 0 (da acquisire nel source-register)",
    "owner": "founder",
    "confidence": "low",
    "validation_status": "unvalidated",
    "evidence_classification": "model_estimate",
    "affected_sections": [
      "04_market-and-competition"
    ],
    "last_updated": "2026-07-16",
    "previous_values": []
  },
  {
    "id": "ASS-007",
    "category": "market",
    "variable": "tam_bottomup",
    "statement": "TAM bottom-up: punti vendita eleggibili x valore annuo",
    "value": 46800000,
    "display_value": "46800000 EUR",
    "unit": "EUR",
    "source": "Derivazione dal modello (ricalcolata dai validator)",
    "owner": "founder",
    "confidence": "low",
    "validation_status": "unvalidated",
    "evidence_classification": "model_estimate",
    "affected_sections": [
      "04_market-and-competition"
    ],
    "last_updated": "2026-07-16",
    "previous_values": [],
    "kind": "derived",
    "derivation": {
      "method": "bottom_up",
      "variables": {
        "eligible_pv": "ASS-004",
        "arpa_pv_year": "ASS-005"
      },
      "formula": "eligible_pv * arpa_pv_year"
    },
    "currency": "EUR",
    "period": "Y1",
    "scenario": "base"
  },
  {
    "id": "ASS-008",
    "category": "market",
    "variable": "w_topdown",
    "statement": "Peso della stima top-down nella riconciliazione TAM",
    "value": 0.5,
    "display_value": "0.5 ratio",
    "unit": "ratio",
    "source": "Founder + concept Sezione 0",
    "owner": "founder",
    "confidence": "low",
    "validation_status": "unvalidated",
    "evidence_classification": "founder_assumption",
    "affected_sections": [
      "04_market-and-competition"
    ],
    "last_updated": "2026-07-16",
    "previous_values": []
  },
  {
    "id": "ASS-009",
    "category": "market",
    "variable": "w_bottomup",
    "statement": "Peso della stima bottom-up nella riconciliazione TAM",
    "value": 0.5,
    "display_value": "0.5 ratio",
    "unit": "ratio",
    "source": "Founder + concept Sezione 0",
    "owner": "founder",
    "confidence": "low",
    "validation_status": "unvalidated",
    "evidence_classification": "founder_assumption",
    "affected_sections": [
      "04_market-and-competition"
    ],
    "last_updated": "2026-07-16",
    "previous_values": []
  },
  {
    "id": "ASS-010",
    "category": "market",
    "variable": "tam_canonical",
    "statement": "TAM riconciliato (media pesata dei due metodi)",
    "value": 48400000,
    "display_value": "48400000 EUR",
    "unit": "EUR",
    "source": "Derivazione dal modello (ricalcolata dai validator)",
    "owner": "founder",
    "confidence": "low",
    "validation_status": "unvalidated",
    "evidence_classification": "model_estimate",
    "affected_sections": [
      "04_market-and-competition"
    ],
    "last_updated": "2026-07-16",
    "previous_values": [],
    "kind": "derived",
    "derivation": {
      "method": "reconciliation",
      "variables": {
        "tam_topdown": "ASS-006",
        "tam_bottomup": "ASS-007",
        "w_topdown": "ASS-008",
        "w_bottomup": "ASS-009"
      },
      "formula": "tam_topdown * w_topdown + tam_bottomup * w_bottomup",
      "strategy": "weighted_average"
    },
    "currency": "EUR",
    "period": "Y1",
    "scenario": "base"
  },
  {
    "id": "ASS-011",
    "category": "market",
    "variable": "addressable_share",
    "statement": "Quota del TAM servibile (catene multi-PV con budget software, vincoli di canale)",
    "value": 0.25,
    "display_value": "0.25 ratio",
    "unit": "ratio",
    "source": "Founder + concept Sezione 0",
    "owner": "founder",
    "confidence": "low",
    "validation_status": "unvalidated",
    "evidence_classification": "founder_assumption",
    "affected_sections": [
      "04_market-and-competition"
    ],
    "last_updated": "2026-07-16",
    "previous_values": []
  },
  {
    "id": "ASS-012",
    "category": "market",
    "variable": "sam_topdown",
    "statement": "SAM: TAM riconciliato x quota servibile",
    "value": 12100000,
    "display_value": "12100000 EUR",
    "unit": "EUR",
    "source": "Derivazione dal modello (ricalcolata dai validator)",
    "owner": "founder",
    "confidence": "low",
    "validation_status": "unvalidated",
    "evidence_classification": "model_estimate",
    "affected_sections": [
      "04_market-and-competition"
    ],
    "last_updated": "2026-07-16",
    "previous_values": [],
    "kind": "derived",
    "derivation": {
      "method": "top_down",
      "variables": {
        "tam_canonical": "ASS-010",
        "addressable_share": "ASS-011"
      },
      "formula": "tam_canonical * addressable_share"
    },
    "currency": "EUR",
    "period": "Y1",
    "scenario": "base"
  },
  {
    "id": "ASS-013",
    "category": "market",
    "variable": "reachable_pv_share",
    "statement": "Quota di punti vendita raggiungibile in Y1 con la capacità commerciale reale",
    "value": 0.02,
    "display_value": "0.02 ratio",
    "unit": "ratio",
    "source": "Founder + concept Sezione 0",
    "owner": "founder",
    "confidence": "low",
    "validation_status": "unvalidated",
    "evidence_classification": "founder_assumption",
    "affected_sections": [
      "04_market-and-competition",
      "06_go-to-market"
    ],
    "last_updated": "2026-07-16",
    "previous_values": []
  },
  {
    "id": "ASS-014",
    "category": "market",
    "variable": "som_y1_revenue",
    "statement": "SOM Y1: punti vendita eleggibili x quota raggiungibile x valore annuo (bottom-up obbligatorio)",
    "value": 936000,
    "display_value": "936000 EUR",
    "unit": "EUR",
    "source": "Derivazione dal modello (ricalcolata dai validator)",
    "owner": "founder",
    "confidence": "low",
    "validation_status": "unvalidated",
    "evidence_classification": "model_estimate",
    "affected_sections": [
      "04_market-and-competition"
    ],
    "last_updated": "2026-07-16",
    "previous_values": [],
    "kind": "derived",
    "derivation": {
      "method": "bottom_up",
      "variables": {
        "eligible_pv": "ASS-004",
        "reachable_pv_share": "ASS-013",
        "arpa_pv_year": "ASS-005"
      },
      "formula": "eligible_pv * reachable_pv_share * arpa_pv_year"
    },
    "currency": "EUR",
    "period": "Y1",
    "scenario": "base"
  },
  {
    "id": "ASS-015",
    "category": "pricing",
    "variable": "price_net_pv_year",
    "statement": "Prezzo netto per punto vendita/anno: listino ASS-001 x 12 (nessuno sconto in Y1)",
    "value": 780,
    "display_value": "780 EUR/count",
    "unit": "EUR/count",
    "source": "Founder + concept Sezione 0",
    "owner": "founder",
    "confidence": "low",
    "validation_status": "unvalidated",
    "evidence_classification": "founder_assumption",
    "affected_sections": [
      "05_business-model",
      "06_go-to-market"